{
  "schema_version": 2,
  "task_id": "T-REPLACE",
  "module": "REPLACE",
  "status": "planned",
  "slices": [
    {
      "id": "S-001",
      "title": "REPLACE",
      "scope": {
        "allowed_paths": [
          "**"
        ],
        "forbidden_paths": []
      },
      "depends_on": [],
      "required_gates": [
        "lint",
        "unit"
      ],
      "risk": "medium",
      "trace": {
        "research": [],
        "decisions": [],
        "incidents": []
      },
      "notes": ""
    }
  ]
}